{
  "decision_id": "dec-203",
  "command_id": "cmd-104",
  "status": "clarify",
  "action": "confirm",
  "decision_outcome": "confirm",
  "confidence": 0.82,
  "payload": {
    "confirmation_id": "confirm-104",
    "summary": "Confirm before assigning this task to another household member.",
    "reasons": ["non_requester_assignment"],
    "proposed_actions": [
      {
        "action": "propose_create_task",
        "payload": {
          "task": {
            "title": "Clean the kitchen",
            "assignee_id": "user-77"
          },
          "idempotency_key": "cmd-104:task"
        }
      }
    ],
    "expires_at": "2026-06-15T12:10:00Z",
    "ui_message": "Please confirm before I propose this change."
  },
  "explanation": "The plan is understood but requires explicit approval before mutation.",
  "trace_id": "trace-203",
  "schema_version": "2.1.0",
  "decision_version": "domain-planner-v1-contract-0.1",
  "created_at": "2026-06-15T12:00:00Z"
}
